id,last_updated,canonical_name,rating,description,episodes_count,genre,seasons_count
2473,2017-08-10 15:51:22+00:00,dancing-with-the-stars,3.242755018,"ABC’s Dancing with the Stars is a spectacular reality competition that focuses on the glamorous and entertaining world of competitive dance. A cast of celebrities from music, TV, film and sports partner with professional dancers and week-to-week, try to impress the judges and the audience at home in order to be the last pair standing - and the ones who waltz away with the coveted mirrorball trophy.",0,Reality and Game Shows,0
1504,2017-08-10 15:44:48+00:00,reba,4.123555575,"Country superstar Reba McEntire made her first foray into series television on REBA, an edgy comedy that takes aim at the all-American family with a spirited look at suburban dysfunction. 

The family members of REBA certainly aren't candidates for a Rockwell portrait, but they muddle through their domestic lives the only way they know how - with brutal honesty and bare-knuckled poise.  REBA will make you laugh as it wins your heart.

REBA was created by Allison M. Gibson (Home Improvement, Boy Meets World).  Kevin Abbott (Roseanne) serves as executive producer with Mindy Schultheis (Titus), Michael Hanel (Titus) and Matt Berry (Roseanne) and Don Beck.  Chris Case, Pat Bullard, Reba McEntire, Patti Carr & Lara Runnels serve as co-executive producers for Twentieth Century Fox Television and Acme Productions. REBA is produced by Twentieth Century Fox Television and is distributed by Twentieth Century Fox Television Distribution.",90,Comedy,4
4412,2017-08-10 16:02:04+00:00,the-bachelorette,3.07734047,"ABC's romance reality show lets one lucky lady narrow the field of bachelors, leaving only her dream man.",5,Reality and Game Shows,1
3708,2017-08-10 15:12:34+00:00,the-bachelor,2.927638092,"ABC's highly-rated, popular romance reality series features a handsome bachelor looking for his soulmate from among 25 bachelorettes.",0,Reality and Game Shows,0
2624,2017-08-10 15:48:25+00:00,the-middle,4.263395482,"Frankie Heck is a superhero. Well, no, not an actual superhero - not unless you count getting her kids out the door for school every morning as a superfeat. Middle-aged, middle class and living in the middle of the country, this harried wife and working mother of three uses her wry wit and sense of humor to try to get her family through each day intact. Frankie has a job selling cars at the town's only surviving car dealer; her husband, Mike, is a manager at the local quarry. Together, they're putting THE MIDDLE on the map.",5,Comedy,1
25839,2017-08-10 15:09:17+00:00,superstore,4.441192282,"Revolving around a group of employees at a big-box store, it examines love, friendship and the beauty of everyday moments.",22,Comedy,1
15138,2017-08-10 14:47:27+00:00,sleepy-hollow,4.566322227,"In this modern-day twist on Washington Irving's classic, ICHABOD CRANE is resurrected and pulled two and a half centuries through time to find that the world is on the brink of destruction, forcing him to team up with a contemporary police officer to unravel a mystery that dates back to the founding fathers.",62,Drama,4
11258,2017-08-10 16:07:32+00:00,chicago-fire,4.6325614999999996,"From renowned, Emmy Award-winning executive producer Dick Wolf (""Law & Order"" brand) and creators Derek Haas and Michael Brandt, the writing team behind ""3:10 to Yuma,"" comes the high-octane drama ""Chicago Fire,"" -- an edge-of-your-seat view into the lives of everyday heroes committed to one of America’s noblest professions.  For the firefighters, rescue squad and paramedics of Chicago Firehouse 51, no occupation is more stressful or dangerous, yet so rewarding and exhilarating.  These courageous men and women are among the elite who forge headfirst into danger when everyone else is running the other way and whose actions make the difference between life and death.  ",5,Drama,1
2313,2017-08-10 16:11:58+00:00,private-practice,4.230377343,"The 'Grey's Anatomy' spin-off focuses on neonatal surgeon Addison Forbes Montgomery, who has left Seattle Grace and moved to L.A., where she practices at the upscale Oceanside Wellness Clinic with her divorced medical-school friends Naomi and Sam Bennett.",111,Drama,6
26058,2017-08-10 15:51:26+00:00,lucifer,4.630420254,"The Devil has come to Los Angeles…Based upon the characters created by Neil Gaiman, Sam Kieth and Mike Dringenberg for DC Entertainment’s Vertigo imprint, LUCIFER is the story of the original fallen angel. Bored and unhappy as the Lord of Hell, LUCIFER MORNINGSTAR (Tom Ellis has abandoned his throne and retired to L.A., where he owns Lux, an upscale nightclub.  Charming, charismatic and devilishly handsome, Lucifer is enjoying his retirement, indulging in a few of his favorite things – wine, women and song – when a beautiful pop star is brutally murdered outside of Lux. For the first time in roughly 10 billion years, he feels something awaken deep within him as a result of this murder. Compassion? Sympathy? The very thought disturbs him – as well as his best friend and confidante, MAZIKEEN aka MAZE (Lesley-Ann Brandt), a fierce demon in the form of a beautiful young woman.",31,Drama,2
1201,2017-08-10 15:10:29+00:00,the-oc,4.054741305,"In The O.C., the lives of a group of friends and families are forever changed when an outsider arrives to their affluent community of Newport Beach in Orange County, California. From Josh Schwartz, the executive producer of Gossip Girl and Chuck, the series became a pop-culture phenomenon with its mix of heart, humor, drama and romance.",92,Drama,4
14027,2017-08-10 15:33:54+00:00,inside-amy-schumer,3.750348077,"Straight-talking comic girl-next-door Amy Schumer is exposing herself -- and her messy world of dating, drinking and public debacles -- when she steps out from behind the microphone for an all-new, genre-busting comedy series.",39,Comedy,4
19145,2017-08-10 15:10:07+00:00,rizzoli-and-isles,4.433746548999999,"Based on the best-selling crime novels, Angie Harmon and Sasha Alexander star as detective Jane Rizzoli and medical examiner Maura Isles. Opposites in many ways -- Rizzoli is brash and tomboyish; the methodical and impeccably dressed Isles is often icy -- together, they use their brilliant minds to bust Boston's most notorious criminals.",105,Drama,7
25243,2017-08-10 16:07:19+00:00,rugrats,3.849742615,"See life from the ground up with Tommy, Chuckie, Susie, Lil, Phil, and the hardly angelic, Angelica. Usually led by fearless leader Tommy, the Rugrats turn the ordinary into the extraordinary and every day into the perfect setting for adventure!",166,Animation and Cartoons,9
18114,2017-08-10 15:50:34+00:00,blue-bloods,4.551720635,Blue Bloods is a drama about a multi-generational family of cops dedicated to New York City law enforcement.,155,Drama,7
15054,2017-08-10 16:02:06+00:00,rabbids-invasion,3.433965658,"The Rabbids land on Earth and everything becomes a source of wonder and entertainment for them. Watch as these indestructible and uncontrollable creatures break all social rules, and create hilarious chaos in their non-stop quest for amusement!",52,Animation and Cartoons,2
12867,2017-08-10 15:08:48+00:00,frasier,4.252930323,"Comedy series set in Seattle, WA, which chronicles the lives of an eloquently pompous radio show host Dr. Frasier Crane (Kelsey Grammer), his brazen radio producer Roz (Peri Gilpin), his competitive, high-brow brother Niles (David Hyde Pierce), their crotchety father Martin (John Mahoney) and his quirky live-in nurse Daphne (Jane Leeves). ",264,Comedy,11
28109,2017-08-10 15:41:33+00:00,gravity-falls,4.598782733,"Twin brother and sister Dipper and Mabel Pines are in for an unexpected adventure when they spend the summer with their great uncle in the mysterious town of Gravity Falls, Oregon. Upon their arrival, Dipper and Mabel's huckster great uncle, also known as Grunkle Stan, enlists the siblings' help in running The Mystery Shack, a fun tourist trap he owns that overcharges unsuspecting customers. Although Dipper and Mabel quickly discover The Mystery Shack itself is a hoax, they sense there is something strange about their new town and together they begin to unlock the secrets of Gravity Falls.",40,Animation and Cartoons,2
11266,2017-08-10 15:37:26+00:00,mistresses-us,4.28725664,"A provocative yet sophisticated drama about four women and their love lives, their sex lives, their secrets, their lies, and above all, their friendship. From ABC Studios, and based on the hit BBC series of the same name, this is Executive Produced by Bob Sertner (""Revenge,"" ""No Ordinary Family""), KJ Steinberg (""Gilded Lilys,"" ""Gossip Girl"") and Rina Mimoun (""Privileged,"" ""Gilmore Girls""). ",52,Drama,4
19289,2017-08-10 14:52:38+00:00,gotham,4.613357996,"Revealing an entirely new chapter that has never been told, in the rise of the great DC Comics Super-Villains and vigilantes, GOTHAM follows one cop, destined for greatness, as he navigates a dangerously corrupt city teetering between good and evil, and chronicles the birth of one of the most popular super heroes of our time.",5,Drama,1
2324,2017-08-10 14:30:57+00:00,inuyasha,4.325406635,"Kagome is a modern high school girl who doesn't believe in the old myths and legends surrounding her grandfather's shrine. That is, until the day she falls into the shrine's well and into another time! In Japan's ancient past, Kagome joins the half demon Inuyasha on a quest to find the scattered shards of the Shikon Jewel, a gem so powerful that demons from across the land will do anything to get even a piece. Along the way they gain friends, battle enemies, and prepare to face their deadliest foe and rival for the Shikon Jewel--Naraku!",334,Anime,7
23481,2017-08-10 15:54:13+00:00,clarence,3.34723817,"Clarence finds something amazing in just about everything. Discover the best that life has to offer--epic pinecone wars, backyard tree forts and the secret worlds beyond milk cartons--all through the eyes of Clarence and his friends, the unpredictable Sumo and overly-cautious Jeff.",77,Animation and Cartoons,2
20977,2017-08-10 15:32:18+00:00,drake-and-josh,3.9418955660000004,"While Drake is laid back and goes with the flow, Josh lives strictly by the rules! But when Josh's dad and Drake's mom get married, these two totally opposite boys become stepbrothers!",47,Kids,4
6290,2017-08-10 16:13:13+00:00,the-voice,4.1234969,"Four famous musician coaches will each select singers to mentor into artists during the blind auditions. Once they have their teams, the star coaches will bring in their personal songwriters, producers, and high-powered friends to help their teams evolve. Ultimately, America will decide which singer will be worthy of the grand prize.",0,Reality and Game Shows,0
20969,2017-08-10 15:49:06+00:00,hey-arnold,4.098780423,"Football-headed Arnold lives with his offbeat grandparents and pet pig in a boarding house inhabited by a bunch of eccentrics. With his best buddy Gerald, Arnold endures playground bullies, crushes, and everything else that comes with big-city life.",99,Animation and Cartoons,5
6901,2017-08-10 16:14:09+00:00,fairy-tail,4.520954045,"When four young wizards from the most destructive guild in Fiore team up to take jobs, they forge a bond more powerful than any magic and grow stronger with every mission. Whatever you do, don't mess with these friends or you'll get burned!",349,Anime,8
20977,2017-08-10 16:05:33+00:00,drake-and-josh,3.942327483,"While Drake is laid back and goes with the flow, Josh lives strictly by the rules! But when Josh's dad and Drake's mom get married, these two totally opposite boys become stepbrothers!",47,Kids,4
20969,2017-08-10 14:38:32+00:00,hey-arnold,4.098780423,"Football-headed Arnold lives with his offbeat grandparents and pet pig in a boarding house inhabited by a bunch of eccentrics. With his best buddy Gerald, Arnold endures playground bullies, crushes, and everything else that comes with big-city life.",99,Animation and Cartoons,5
14114,2017-08-10 16:01:12+00:00,east-los-high,4.15686925,"East Los High is a breakthrough Hulu Original that centers around romance, dance, and the struggle of a group of Latino teens living in East Los Angeles.",60,Drama,4
1349,2017-08-10 15:46:19+00:00,sesame-street,3.363741534,"The beloved show ""Sesame Street"" combines education and entertainment to make a meaningful difference in children's lives. Besides teaching letters and numbers, ""Sesame Street"" fosters imagination, builds social skills, and models respect for people's differences, whether they're based in race, gender, ethnicity, googly eyes, or neon fur.",60,Kids,3
10,2017-08-10 16:13:50+00:00,bones,4.618597705,Forensic anthropologist Dr. Temperance Brennan uses her uncanny ability to read clues left behind in bones to help FBI agent Seeley Booth solve murder cases. Based on the life of anthropologist and novelist Kathy Reichs.,246,Drama,12
11226,2017-08-10 16:14:04+00:00,nashville,4.424511513000001,"A legendary queen of country music struggles to maintain her place in the spotlight while dealing with an ambitious rising pop-country vixen who wants to knock her off the throne. From executive producer Callie Khouri (writer of Thelma & Louise) comes this contemporary musical drama about love, power, money, family and music. ",107,Drama,5
14114,2017-08-10 15:56:16+00:00,east-los-high,4.15686925,"East Los High is a breakthrough Hulu Original that centers around romance, dance, and the struggle of a group of Latino teens living in East Los Angeles.",60,Drama,4
1349,2017-08-10 15:58:55+00:00,sesame-street,3.3638134930000003,"The beloved show ""Sesame Street"" combines education and entertainment to make a meaningful difference in children's lives. Besides teaching letters and numbers, ""Sesame Street"" fosters imagination, builds social skills, and models respect for people's differences, whether they're based in race, gender, ethnicity, googly eyes, or neon fur.",60,Kids,3
23170,2017-08-10 15:30:25+00:00,casual,4.536517228,"From the Academy Award Nominated Director of “Up in the Air” and “Juno” comes Casual, a new comedy series about a bachelor brother and his newly divorced sister living under one roof again. Together, they coach each other through the crazy world of dating while raising her teenage daughter. Created by Zander Lehmann, Casual is executive produced by Jason Reitman, Zander Lehmann, Helen Estabrook, and Liz Tigelaar.",36,Comedy,3
11258,2017-08-10 16:14:43+00:00,chicago-fire,4.6325614999999996,"From renowned, Emmy Award-winning executive producer Dick Wolf (""Law & Order"" brand) and creators Derek Haas and Michael Brandt, the writing team behind ""3:10 to Yuma,"" comes the high-octane drama ""Chicago Fire,"" -- an edge-of-your-seat view into the lives of everyday heroes committed to one of America’s noblest professions.  For the firefighters, rescue squad and paramedics of Chicago Firehouse 51, no occupation is more stressful or dangerous, yet so rewarding and exhilarating.  These courageous men and women are among the elite who forge headfirst into danger when everyone else is running the other way and whose actions make the difference between life and death.  ",5,Drama,1
23170,2017-08-10 15:34:53+00:00,casual,4.536517228,"From the Academy Award Nominated Director of “Up in the Air” and “Juno” comes Casual, a new comedy series about a bachelor brother and his newly divorced sister living under one roof again. Together, they coach each other through the crazy world of dating while raising her teenage daughter. Created by Zander Lehmann, Casual is executive produced by Jason Reitman, Zander Lehmann, Helen Estabrook, and Liz Tigelaar.",36,Comedy,3
16720,2017-08-10 15:44:45+00:00,chicago-pd,4.549655876,"District 21 of the Chicago Police Department is made up of two distinctly different groups: The uniformed cops who patrol the beat and deal with street crimes, and the intelligence unit, the team that combats the city's major offenses, such as organized crime, drug trafficking and high-profile murders.",23,Drama,1
22751,2017-08-10 16:09:27+00:00,ready-steady-wiggle,2.193160087,"Join The Wiggles - Anthony, Emma, Lachy and Simon - on an exciting new adventure during this new series featuring over 70 songs, including Wiggle classics and new material.",104,Kids,2
