id,last_updated,canonical_name,rating,description,episodes_count,genre,seasons_count
54,2017-08-10 14:53:04+00:00,family-guy,4.35370739,The adventures of an endearingly ignorant dad and his hilariously odd family of middle-class New Englanders.,288,Animation and Cartoons,15
6979,2017-08-10 14:14:33+00:00,south-park,4.36303207,"Underpants-stealing gnomes, a talking Christmas poo, metrosexual Crab People…Every episode of this critically-acclaimed and award-winning show is packed with unforgettable adventures, cutting satire, and hilarious absurdity – from pissed off celebrities to talking towels to crime-fighting kids. So join Kyle, Stan, Kenny and Cartman for the all the dysfunction and all the excitement. For them, it's just a part of growing up in South Park!",274,Comedy,20
53,2017-08-10 14:46:51+00:00,american-dad,4.114006824,This screwball family full of radically different personalities is just trying to figure out how to love and trust one another in a bi-partisan world.,172,Comedy,9
389,2017-08-10 15:00:39+00:00,law-and-order-special-victims-unit,4.622855997,"This hard-hitting and emotional series from NBC's ""Law & Order"" brand chronicles the life and crimes of the Special Victims Unit of the New York City Police Department, an elite squad of detectives who investigate sexually based crimes. ",406,Drama,18
1603,2017-08-10 14:54:31+00:00,naruto-shippuden,4.400626276000001,"The Village Hidden in the Leaves is home to the stealthiest ninja in the land.  But twelve years earlier, a fearsome Nine-tailed Fox terrorized the village before it was subdued and its spirit sealed within the body of a baby boy.  Now that boy, Naruto, has grown up to become a hyperactive ninja-in-training who's more interested in pranks than schoolwork...but Naruto is determined to become the greatest ninja ever!",597,Anime,9
23104,2017-08-10 15:20:19+00:00,seinfeld,4.366506162,"Emmy award-winning ""Seinfeld"" is one of the most popular shows on the air. Mining his rich comedic resources, Jerry Seinfeld provides a hysterical look at life as a single adult in the '90s. Along with a refreshing cast and top-notch writing, this series is quickly becoming a comedy classic.",171,Comedy,9
2553,2017-08-10 15:51:53+00:00,modern-family,4.6405570019999995,"Today's American families come in all shapes and sizes. The cookie cutter mold of man + wife + 2.5 kids is a thing of the past, as it becomes quickly apparent in the bird's eye view of ABC's half-hour comedy, which takes an honest and often hilarious look at the composition and complexity of modern family life.",22,Comedy,1
22416,2017-08-10 14:41:25+00:00,adventure-time,4.36580305,"It's one crazy adventure after another for human boy, Finn, and his best friend, Jake, a 28-year old dog with magical powers. They're out to have the most fun possible and they sure do find it exploring the Land of Ooo! Whether it's saving Princess Bubblegum, battling zombie candy, taunting the Ice King or rocking out with Marceline the Vampire Queen, with Finn and Jake it's always ADVENTURE TIME!",223,Kids,7
77,2017-08-10 15:01:46+00:00,saturday-night-live,4.083795347,NBC in association with Broadway Video Enterprises bring you the landmark sketch comedy series.,370,Comedy,18
11248,2017-08-10 14:58:23+00:00,the-mindy-project,4.440965244,"A single-camera comedy, starring Mindy Kaling, that follows a skilled OB/GYN navigating the tricky waters of both her personal and professional life, as she pursues her dreams of becoming the perfect woman, finding the perfect man and getting her perfect romantic comedy ending.",107,Comedy,5
2505,2017-08-10 14:35:54+00:00,community,4.583853327,"Disbarred lawyer Jeff Winger enrolls in a local community college. While there, he forms a study group who eventually learn more about themselves than their course work.",110,Comedy,6
2252,2017-08-10 15:23:19+00:00,greys-anatomy,4.462517355,"The doctors of Grey Sloan Memorial Hospital deal with life-or-death consequences on a daily basis – it's in one another that they find comfort, friendship and, at times, more than friendship. Together they're discovering that neither medicine nor relationships can be defined in black and white. Real life only comes in shades of grey.",24,Drama,1
58,2017-08-10 14:58:44+00:00,the-simpsons,4.2592977869999995,"This long-running animated comedy focuses on the eponymous family in the town of Springfield in an unnamed U.S. state. The head of the Simpson family, Homer, is not a typical family man. A nuclear-plant employee, he does his best to lead his family but often finds that they are leading him. The family includes loving, blue-haired matriarch Marge, troublemaking son Bart, overachieving daughter Lisa and baby Maggie. Other Springfield residents include the family's religious neighbor, Ned Flanders, family physician Dr. Hibbert, Moe the bartender and police chief Clancy Wiggum.",21,Comedy,1
15137,2017-08-10 14:22:56+00:00,brooklyn-nine-nine,4.525913142,"BROOKLYN NINE-NINE is an ensemble comedy about a talented-but-carefree detective, a by-the-book police captain and their precinct colleagues. While based in the workplace, the series is not really about the job – it’s about the men and women behind the badge.",90,Comedy,4
1968,2017-08-10 14:46:29+00:00,parks-and-recreation,4.582548165,"Leslie Knope takes on the system in Pawnee, IN.",123,Comedy,7
22015,2017-08-10 14:53:53+00:00,the-amazing-world-of-gumball,4.0158769560000005,"Gumball’s world is pretty run-of-the-mill. He’s chased around school by a T-Rex. He has a friend named Anton who’s a piece of toast. He’s got a crush on Penny, a peanut with antlers. His dad is a 6’4” bunny. His mom works at a Rainbow Factory. And his brother is a goldfish named Darwin. Yup, everything looks perfectly normal here.",156,Kids,4
4910,2017-08-10 14:39:09+00:00,bobs-burgers,4.323962371,"Bob runs Bob's Burgers with the help of his wife and their three kids. Business may be slow, but they never give up hope.",129,Animation and Cartoons,7
7529,2017-08-10 14:55:15+00:00,new-girl,4.5882924880000004,"An ensemble comedy centering on a free-spirited young woman, her three male roommates and her best friend, as they navigate modern relationships and end up forming a charmingly dysfunctional – or strangely functional –  family.",22,Comedy,1
2103,2017-08-10 15:56:52+00:00,glee,4.187489416,"A group of ambitious and talented kids find strength, acceptance and, ultimately, their voices in this uplifting musical comedy.",121,Drama,6
10,2017-08-10 15:46:57+00:00,bones,4.618597705,Forensic anthropologist Dr. Temperance Brennan uses her uncanny ability to read clues left behind in bones to help FBI agent Seeley Booth solve murder cases. Based on the life of anthropologist and novelist Kathy Reichs.,246,Drama,12
11226,2017-08-10 14:40:14+00:00,nashville,4.424495117,"A legendary queen of country music struggles to maintain her place in the spotlight while dealing with an ambitious rising pop-country vixen who wants to knock her off the throne. From executive producer Callie Khouri (writer of Thelma & Louise) comes this contemporary musical drama about love, power, money, family and music. ",107,Drama,5
22278,2017-08-10 14:46:00+00:00,regular-show,4.061273937,"Mordecai – a sarcastic blue jay, and Rigby – a somewhat responsible raccoon, are best friends. They even work together at a park owned by Pops, a big lollipop-headed guy. Which seems normal enough. They’ve got a cranky gumball machine for a boss and they work alongside a Zen-like yeti named Skips. Yep. Everything is as regular as can be.",217,Kids,7
7555,2017-08-10 15:52:49+00:00,once-upon-a-time,4.715775889,"From the inventive minds of Lost executive producers Adam Horowitz and Edward Kitsis comes a bold new imagining of the world, where fairy tales and the modern day are about to collide.",22,Drama,1
22881,2017-08-10 15:08:06+00:00,rick-and-morty,4.772879511,"Rick and Morty is a show about a sociopathic scientist who drags his unintelligent grandson on insanely dangerous adventures across the universe. Created and executive produced by Dan Harmon (Community, Channel 101) and Justin Roiland (House of Cosbys).",21,Animation and Cartoons,2
6341,2017-08-10 14:38:38+00:00,workaholics,4.577148191,"College is over but the party isn’t. Join three best buds as they share a job, a crash pad and a promise to never let work get in the way of a good time—on this raucously original series.",86,Comedy,7
1318,2017-08-10 15:31:01+00:00,bleach,4.421983759,"For as long as he can remember, Ichigo Kurosaki has been able to see ghosts. But when he meets Rukia, a Soul Reaper who battles evil spirits known as Hollows, he finds his life is changed forever when Rukia transfers most of her powers to him. Now a Soul Reaper himself with a new found wealth of spiritual energy, Ichigo discovers his true calling: to protect the living and the dead from evil. But when Rukia's actions are called under scrutiny, Ichigo and his friends must put everything on the line to prepare to save their friend from the harsh justice of the Soul Society.",732,Anime,26
2138,2017-08-10 14:10:34+00:00,one-piece,4.146686058999999,"Monkey D. Luffy refuses to let anyone or anything stand in the way of his quest to become king of all pirates. With a course charted for the treacherous waters of the Grand Line, this is one captain who’ll never drop anchor until he’s claimed the greatest treasure on Earth – the Legendary One Piece!",747,Anime,11
6290,2017-08-10 14:42:28+00:00,the-voice,4.1234969,"Four famous musician coaches will each select singers to mentor into artists during the blind auditions. Once they have their teams, the star coaches will bring in their personal songwriters, producers, and high-powered friends to help their teams evolve. Ultimately, America will decide which singer will be worthy of the grand prize.",0,Reality and Game Shows,0
22638,2017-08-10 15:57:42+00:00,doc-mcstuffins,3.503616156,"A magical animated series about a six-year-old girl, Doc McStuffins, who has the ability to talk to and heal toys and stuffed animals! With the help of her stuffed animal friends, Doc runs a clinic for toys out of her playhouse. The series emphasizes the importance of lending a helping hand, or paw, when people and toys need it most.",92,Animation and Cartoons,3
148,2017-08-10 15:03:40+00:00,hells-kitchen,4.05219787,An unscripted culinary boot camp that features the drama of aspiring restaurateurs competing for world-renowned Chef Gordon Ramsay’s approval and the chance to become America’s next culinary star.,0,Reality and Game Shows,0
21027,2017-08-10 15:32:23+00:00,empire,4.57500889,"From Academy Award nominee Lee Daniels (“Lee Daniels’ The Butler,” “Precious”) and Emmy Award winner Danny Strong (“Game Change,” “Lee Daniels’ The Butler”), comes EMPIRE, a sexy and powerful new drama about the head of a music empire whose three sons and wife all battle for his throne. Set to an original soundtrack written and produced by hip-hop hitmaker Timbaland, the family drama stars Academy Award nominee Terrence Howard (“Crash,” “Hustle & Flow”) and Academy Award and Emmy Award nominee Taraji P. Henson (“Person of Interest,” “The Curious Case of Benjamin Button”).",48,Drama,3
35,2017-08-10 14:43:49+00:00,its-always-sunny-in-philadelphia,4.478408089,"Wednesdays at 10pm on FXX. It's Always Sunny in Philadelphia features Mac, Dennis, Charlie, Sweet Dee and Frank, five ne’er-do-wells who own and operate Paddy’s Pub in Philadelphia. Their constant scheming usually lands them in a world of hurt, yet they never seem to learn from their mistakes. As they say, some things never change. So prepare for more depraved schemes, half-baked arguments and absurdly underhanded plots to subvert one another.

It's Always Sunny in Philadelphia was created by Rob McElhenney and is executive produced by Rob McElhenney, Charlie Day, Glenn Howerton, Michael Rotenberg, Nicholas Frenkel, Tom Lofaro, Rob Rosell, Scott Marder and David Hornsby. An FX Networks Original Series.",123,Comedy,11
150,2017-08-10 15:39:59+00:00,keeping-up-with-the-kardashians,3.2116053780000002,Keeping Up with the Kardashians takes viewers inside the hectic lives of Hollywood's modern-day Brady Bunch. Can two famous clans come together as one united front? Or will their individual lust for the limelight end up fracturing the family?,181,Reality and Game Shows,12
15094,2017-08-10 15:14:51+00:00,the-good-wife,4.560711786000001,"Julianna Margulies (ER) ignites the screen as Alicia Florrick, the political wife whose world is shattered when her husband (Chris Noth, Sex & the City, Law & Order) is caught in a sex and corruption scandal. Forced to support her family, Alicia returns to work at a Chicago law firm headed by Diane Lockhart (Emmy and Tony Award winner Christine Baranski) and Will Gardner (Josh Charles), a driven attorney with a passion for justice. A gripping blend of courtroom drama, politics and steamy personal relationships, THE GOOD WIFE features an A-List cast of regulars and guest stars like Michael J. Fox, Matthew Perry and Rita Wilson. Hailed by the Chicago Tribune for its “deluxe production values, smart writing, and outstanding array of actors,” the series earned 14 Emmy nominations in its first two seasons alone. With fascinating characters and timely scripts torn from the headlines, the verdict is in: THE GOOD WIFE is great entertainment.",156,Drama,7
13844,2017-08-10 14:58:12+00:00,curious-george,3.578587476,"For nearly 65 years, generations of young children have been charmed by the literary adventures of Curious George. Now George is ready for his next big adventure! Based on the best-selling Curious George books by Margret and H.A. Rey, the series expands George’s world to include a host of colorful new characters and original locales, while maintaining the charm of the beloved books. The series aims to inspire kids to explore science, math, and engineering in the world around them.",108,Kids,9
1304,2017-08-10 14:27:54+00:00,naruto,4.212936615,"The Village Hidden in the Leaves is home to the stealthiest ninja in the land.  But twelve years earlier, a fearsome Nine-tailed Fox terrorized the village before it was subdued and its spirit sealed within the body of a baby boy--Naruto Uzumaki!",440,Anime,4
15360,2017-08-10 14:59:23+00:00,the-goldbergs,4.384575644,"The Goldbergs are a loving family like any other, just with a lot more yelling, but for geeky 11-year old Adam these were his wonder years and he faced them armed with a video camera to capture all the crazy.",95,Comedy,4
19738,2017-08-10 15:22:30+00:00,blackish,4.23707817,"Andre 'Dre' Johnson has a great job, a beautiful wife, Rainbow, four kids, and a colonial home in the 'burbs. But has success brought too much assimilation for this black family?",72,Comedy,3
2259,2017-08-10 15:29:44+00:00,desperate-housewives,3.698476373,"ABC's Desperate Housewives offers a deliciously juicy glimpse into the lives of everyone's favorite housewives. On the surface, the ladies of Wisteria Lane appear to be the picture of suburban America. But underneath lay bigger mysteries - infidelity, deceit, blackmail, and even murder. And with not-so-honest husbands, complicated relationships, family drama and meddling neighbors adding to the turmoil, it's no wonder things aren't always as they seem.",180,Drama,8
7889,2017-08-10 14:12:49+00:00,csi-crime-scene-investigation,4.496905704,"""CSI: Crime Scene Investigation"" is a fast-paced drama about a team of forensic investigators trained to solve crimes by examining the evidence. They are on the case 24/7, scouring the scene, collecting the irrefutable evidence and finding the missing pieces that will solve the mystery.",337,Drama,16
3433,2017-08-10 15:04:59+00:00,archer,4.448908555,"Archer chronicles an international spy agency and the lives of its employees. Although their work of espionage, reconnaissance missions, wiretapping and undercover surveillance is daunting and dangerous, every covert operation and global crisis is actually just another excuse for the staff to undermine, sabotage and betray each other for personal gain. ",85,Animation and Cartoons,7
16937,2017-08-10 14:21:23+00:00,broad-city,4.642177106,"A bottle of wine tastes just as good when you pay with all pennies. That's a fact. And no matter what the city throws at twenty-somethings Abbi and Ilana, these broads are all in. Catch the totally fresh, new series based on the acclaimed digital shorts.",30,Comedy,3
8322,2017-08-10 15:43:43+00:00,americas-next-top-model,3.5413735789999996,"Young women of various backgrounds, shapes and sizes compete to prove that they can make it in the high-stress, high-stakes world of modeling. With mentoring by supermodel Tyra Banks and exposure to prolific fashion-industry gurus, the finalists compete in an accelerated modeling boot camp. Participants learn to master complicated catwalks, fashion photo shoots and perfect publicity skills, all under 24-hour-a-day surveillance of the cameras that chronicle every move.",283,Reality and Game Shows,22
17312,2017-08-10 15:56:15+00:00,the-tonight-show-starring-jimmy-fallon,4.155577697,"Join Jimmy Fallon for a daily mix of jokes, sketches, celebrity interviews and musical guests.",18,Comedy,1
8898,2017-08-10 14:42:00+00:00,key-and-peele,4.438184167,"Tired of watching just one comedian at a time? Get a pair. Catch sketch comedy masters and best friends Keegan-Michael Key and Jordan Peele for a half hour of irreverent wit, pop-culture impressions and escalating absurdity.",53,Comedy,5
29524,2017-08-10 15:28:43+00:00,the-golden-girls,4.591255389,"The Golden Girls is the story of four older women who share a house in Miami Beach, Florida. Bea Arthur plays Dorothy, a divorced school teacher, with a sardonic wit. Rue McClanahan plays Blanche, a man-hunting Southern Belle. Betty White plays Rose, a very sweet woman who is somewhat spacey. Rounding out the trio is Estelle Getty, playing Dorothy's outspoken mother, Sophia. ",180,Classics,7
21721,2017-08-10 14:30:46+00:00,steven-universe,4.416828893,"Steven Universe is about the misadventures of a boy named Steven, the ultimate ""little brother"" to a team of magical guardians of humanity—the Crystal Gems. Steven may not be as powerful as the Crystal Gems. Or as savvy. But that doesn't stop him from joining Garnet, Amethyst and Pearl on their magical adventures and somehow finding a way to save the day!",102,Comedy,3
57,2017-08-10 15:12:13+00:00,kitchen-nightmares,4.019048561,An unscripted series in which Gordon Ramsay attempts to turn deserted restaurants into the most sought-after venues in town.,92,Reality and Game Shows,6
21985,2017-08-10 14:22:08+00:00,the-last-man-on-earth,4.339346137,"The year is 2020, and after a deadly virus has swept the planet, only one man is left on earth: Phil Miller (Will Forte). He used to be just an average guy who loved his family and hated his job. Now, in his RV, Phil searches the country for other survivors. He has traveled to every city, every town and every outpost in the United States, Mexico and Canada, and has found no one. As he returns to his hometown of Tucson, Phil comes to the painful realization that he is almost certainly the last living being on the face of the earth. All he wants is for someone – anyone – to find him in Tucson – preferably a woman. ",48,Comedy,3
5638,2017-08-10 14:38:02+00:00,yu-gi-oh,3.6746067410000003,"Meet Yugi, an eager young freshman at Domino High School. Yugi and his best friends, Joey, Tristan, and Tea share a love of a cool new game that's sweeping the nation...Duel Monsters! In this card-battling game, players pit different mystical creatures against one another in action-packed, high intensity duels.",236,Anime,5
23200,2017-08-10 15:10:16+00:00,elementary,4.574669187,ELEMENTARY stars Jonny Lee Miller as detective Sherlock Holmes and Lucy Liu as Dr. Joan Watson in a modern-day drama about a crime-solving duo that cracks the NYPD’s most impossible cases.,120,Drama,5
969,2017-08-10 15:37:26+00:00,americas-got-talent,3.335469442,America votes in the ultimate talent show to determine which act deserves a million dollars.,12,Reality and Game Shows,1
12844,2017-08-10 14:38:08+00:00,sabrina-the-teenage-witch,3.905827813,"Sabrina is a normal teenager, except for one thing -- she's a witch! Guided by her aunts, who come from a long line of witches, and Salem, a mischievous warlock doing penance as a black cat, Sabrina continually struggles to harness her powers while wittingly wreaking havoc on friends and foes alike. While struggling through the growing pains associated with being a witch and getting into lots of harmless trouble along the way, Sabrina realizes that magic is not quite as easy as pointing your finger.",163,Family,7
2458,2017-08-10 15:04:09+00:00,shark-tank,4.278262211,"From Executive Producer Mark Burnett comes an inventive new reality series you can sink your teeth into. Budding entrepreneurs with big ideas can still make their dreams come true and ABC is about to give them the chance to make it happen. Each week a group of self-made millionaires from all corners of the business world take their own hard earned money and offer everyday people their one true shot at making their dreams a reality. Some will sink, some will swim and some will be eaten alive.",5,Reality and Game Shows,2
12138,2017-08-10 15:38:23+00:00,teenage-mutant-ninja-turtles,3.7796865110000004,"Master Splinter allows the Turtles to visit the surface for the first time, where they'll learn the importance of working as a team, uncover the mystery of their existence, and face fearsome enemies such as the Kraang and the ruthless Shredder.",100,Kids,4
51,2017-08-10 14:13:00+00:00,arrested-development,4.687830774,"In this critically acclaimed series, Michael Bluth is forced to help his wildly eccentric family pick up the pieces after its wealthy patriarch is arrested and its assets frozen.",53,Comedy,3
1861,2017-08-10 15:19:26+00:00,stargate-sg-1,4.315301436,"Step through the stargate with SG-1, a team of soldiers and scientists, as they travel instantaneously to other planets to explore, forge alliances, defuse crises, establish trade, investigate ancient mysteries, and defend Earth from such hostile forces as the Goa'uld, the Replicators, and the Ori.",214,Science Fiction,10
6901,2017-08-10 14:25:33+00:00,fairy-tail,4.520954045,"When four young wizards from the most destructive guild in Fiore team up to take jobs, they forge a bond more powerful than any magic and grow stronger with every mission. Whatever you do, don't mess with these friends or you'll get burned!",349,Anime,8
177,2017-08-10 14:48:45+00:00,top-chef,4.252735986999999,"Top Chef offers a fascinating window into the competitive, pressure-filled environment of world class cookery and the restaurant business at the highest level. The series features seventeen aspiring chefs who compete for their shot at culinary stardom and the chance to earn the prestigious title of ""Top Chef.""",203,Reality and Game Shows,13
9673,2017-08-10 15:14:17+00:00,scandal,4.711270845,"A former media relations consultant to the President, Olivia Pope (Kerry Washington) dedicates her life to protecting and defending the public images of our nation's elite. After leaving the White House, the power consultant opened her own firm, hoping to start a new chapter -- both professionally and personally -- but she can't seem to completely cut ties with her past. Slowly it becomes apparent that her staff, who specialize in fixing the lives of other people, can't quite fix the ones closest at hand -- their own.",5,Drama,1
11217,2017-08-10 15:22:51+00:00,smallville,4.467553413,"After a meteor shower bursts from the heavens, raining destruction on the unsuspecting citizens of Smallville, years pass, and the healing process leaves the town's inhabitants with scars and secrets. From the ashes of tragedy, a popular yet awkward teen attempts to decipher the meaning of his life and his clouded past.",218,Drama,10
7281,2017-08-10 15:24:45+00:00,grimm,4.600659796,"From executive producers David Greenwalt (Angel, Buffy the Vampire Slayer) and Jim Kouf (Angel, National Treasure) comes a new world of police work where all cases have a storybook connection, but not always happily ever after.",5,Action and Adventure,1
28409,2017-08-10 14:23:55+00:00,this-is-us,4.795632995,"From the writer and director of Crazy, Stupid, Love comes a smart, modern new dramedy that will challenge your everyday presumptions about the people you think you know.",18,Drama,1
4726,2017-08-10 14:53:58+00:00,masterchef,4.217078235,"A culinary competition series that searches for the best home cooks in America, and through a series of exciting elimination rounds, will turn one of them into a culinary master.",10,Food,1
15896,2017-08-10 15:28:59+00:00,the-thundermans,4.024492557,"The Thundermans are just like any other American family, but they're superheroes! Watch this super family battle some serious sibling rivalry and eventually work together to use their extraordinary powers to create an ordinary life!",69,Kids,3
13482,2017-08-10 14:51:44+00:00,vikings,4.78311932,The name Viking is synonymous with extreme violence and terror. But few people know what it was really like to live in the world of the Viking.  This scripted drama will use real characters from history to humanize the Viking and authentically re-create the Viking Age.,49,Action and Adventure,4
4483,2017-08-10 15:21:42+00:00,pretty-little-liars,4.498914555,"Four estranged best friends are reunited one year after the queen bee of the group, Alison, goes missing. When they begin to receive disturbing messages from someone named “A”, how far will they go to bury their secrets?",5,Drama,1
